{
  "schema_version": 1,
  "contract_sha256": "c8b6d55be86663c29db88d39aba96cfd1c9bde954d1ad6f023743537789d2a04",
  "artifact_manifest_id": "am-phase2-official-20260830.blockwise_fp8_2sm_g64x4x32.a001",
  "attempt_id": "phase2-official-20260830.blockwise_fp8_2sm_g64x4x32.a001",
  "instance_ref": {
    "id": "blockwise_fp8_2sm_g64x4x32",
    "path": "tests/codegen/instances/blockwise_fp8_2sm_g64x4x32/instance.json",
    "sha256": "4b47a9717926f7070040788f17d94085b93133a480c1078e79399823c00b8368"
  },
  "fingerprint_ref": {
    "id": "fp-blockwise_fp8_2sm_g64x4x32-86a35079975e",
    "path": "evidence/codegen-sm110a-v2/fingerprints/fp-blockwise_fp8_2sm_g64x4x32-86a35079975e.json",
    "sha256": "aa148e14a277c888c18c07458f1ce261d0c46813eac29d9a79e831a1b8e3609a"
  },
  "items": [
    {
      "artifact_id": "config_source",
      "role": "KERNEL_SOURCE_SNAPSHOT",
      "path": "artifacts/codegen-sm110a-v2/phase2-official-20260830/attempts/phase2-official-20260830.blockwise_fp8_2sm_g64x4x32.a001/full/source/config-config.hpp",
      "storage": "ignored_archive",
      "media_type": "text/x-c++hdr",
      "sha256": "3e1e778a3ae305bb229244f45856a6afc593064f82ad76ebceb79e0af84096f5",
      "size_bytes": 3895,
      "producer_step_id": "snapshot_sources",
      "parent_artifact_ids": [],
      "sealed": true
    },
    {
      "artifact_id": "kernel_source",
      "role": "KERNEL_SOURCE_SNAPSHOT",
      "path": "artifacts/codegen-sm110a-v2/phase2-official-20260830/attempts/phase2-official-20260830.blockwise_fp8_2sm_g64x4x32.a001/full/source/kernel-kernel.cu",
      "storage": "ignored_archive",
      "media_type": "text/x-cuda",
      "sha256": "6747393efc3c05878adfa7c8331ee26f87f0176ca05a57c9a56b896f8d24d7c3",
      "size_bytes": 302,
      "producer_step_id": "snapshot_sources",
      "parent_artifact_ids": [
        "config_source"
      ],
      "sealed": true
    },
    {
      "artifact_id": "type_source",
      "role": "TYPE_WITNESS_SOURCE_SNAPSHOT",
      "path": "artifacts/codegen-sm110a-v2/phase2-official-20260830/attempts/phase2-official-20260830.blockwise_fp8_2sm_g64x4x32.a001/full/source/type_witness-type_witness.cu",
      "storage": "ignored_archive",
      "media_type": "text/x-cuda",
      "sha256": "a0a6d14750cf6772871e47511e47e49ccbfa093940f7b293e913e557f4106cbe",
      "size_bytes": 287,
      "producer_step_id": "snapshot_sources",
      "parent_artifact_ids": [
        "config_source"
      ],
      "sealed": true
    },
    {
      "artifact_id": "type_executable",
      "role": "TYPE_WITNESS_EXECUTABLE",
      "path": "artifacts/codegen-sm110a-v2/phase2-official-20260830/attempts/phase2-official-20260830.blockwise_fp8_2sm_g64x4x32.a001/full/type_witness",
      "storage": "ignored_archive",
      "media_type": "application/x-executable",
      "sha256": "e650a01a989feb619881d1a40faa266d4761c40423800036c7ae732fd3b1e194",
      "size_bytes": 1063416,
      "producer_step_id": "compile_type_witness",
      "parent_artifact_ids": [
        "type_source",
        "config_source"
      ],
      "sealed": true
    },
    {
      "artifact_id": "type_output",
      "role": "TYPE_WITNESS_OUTPUT",
      "path": "evidence/codegen-sm110a-v2/excerpts/phase2-official-20260830.blockwise_fp8_2sm_g64x4x32.a001/resolved-types.json",
      "storage": "git_evidence",
      "media_type": "application/json",
      "sha256": "bcc0adfc979962cdbc788500c0799bd007b45ab2b99584b18d4be6f8cb954231",
      "size_bytes": 17405,
      "producer_step_id": "run_type_witness",
      "parent_artifact_ids": [
        "type_executable"
      ],
      "sealed": true
    },
    {
      "artifact_id": "fatbin",
      "role": "FATBIN",
      "path": "artifacts/codegen-sm110a-v2/phase2-official-20260830/attempts/phase2-official-20260830.blockwise_fp8_2sm_g64x4x32.a001/full/kernel.fatbin",
      "storage": "ignored_archive",
      "media_type": "application/x-fatbin",
      "sha256": "6b818ca48047f5bcac3c342544e20a730ead237b88ce826e3402ec77464b142f",
      "size_bytes": 274096,
      "producer_step_id": "compile_fatbin",
      "parent_artifact_ids": [
        "kernel_source",
        "config_source"
      ],
      "sealed": true
    },
    {
      "artifact_id": "ptx_full",
      "role": "PTX_FULL",
      "path": "artifacts/codegen-sm110a-v2/phase2-official-20260830/attempts/phase2-official-20260830.blockwise_fp8_2sm_g64x4x32.a001/full/extracted/kernel.1.sm_110a.ptx",
      "storage": "ignored_archive",
      "media_type": "text/x-ptx",
      "sha256": "78ef2cb90e5e2bd59dcb299e19f32c43ee130caf63524854611f08771f988b98",
      "size_bytes": 160058,
      "producer_step_id": "extract_ptx",
      "parent_artifact_ids": [
        "fatbin"
      ],
      "sealed": true
    },
    {
      "artifact_id": "cubin",
      "role": "CUBIN",
      "path": "artifacts/codegen-sm110a-v2/phase2-official-20260830/attempts/phase2-official-20260830.blockwise_fp8_2sm_g64x4x32.a001/full/extracted/kernel.1.sm_110a.cubin",
      "storage": "ignored_archive",
      "media_type": "application/x-cubin",
      "sha256": "aa1bce633e1546a0dde9f38abe689c73c51a17d25e794d9129d99dbb89fae219",
      "size_bytes": 246872,
      "producer_step_id": "extract_elf",
      "parent_artifact_ids": [
        "fatbin"
      ],
      "sealed": true
    },
    {
      "artifact_id": "elf_symbols",
      "role": "ELF_SYMBOL_TABLE",
      "path": "artifacts/codegen-sm110a-v2/phase2-official-20260830/attempts/phase2-official-20260830.blockwise_fp8_2sm_g64x4x32.a001/full/elf-symbols.txt",
      "storage": "ignored_archive",
      "media_type": "text/plain",
      "sha256": "8bbc9ab09457dcdd371dd7bae0457687ec8dc98ffd4c670751201b29760eb831",
      "size_bytes": 3698,
      "producer_step_id": "elf_symbols",
      "parent_artifact_ids": [
        "cubin"
      ],
      "sealed": true
    },
    {
      "artifact_id": "code_metadata",
      "role": "CODE_OBJECT_METADATA",
      "path": "artifacts/codegen-sm110a-v2/phase2-official-20260830/attempts/phase2-official-20260830.blockwise_fp8_2sm_g64x4x32.a001/full/cuobjdump-sass.txt",
      "storage": "ignored_archive",
      "media_type": "text/plain",
      "sha256": "c1d8e12ef57b6bd97cbcc91ca2bfe7d90fc16e02ac80047416767ec2db9ff384",
      "size_bytes": 1381853,
      "producer_step_id": "code_object_metadata",
      "parent_artifact_ids": [
        "cubin"
      ],
      "sealed": true
    },
    {
      "artifact_id": "nvdisasm_json",
      "role": "NVDISASM_JSON_FULL",
      "path": "artifacts/codegen-sm110a-v2/phase2-official-20260830/attempts/phase2-official-20260830.blockwise_fp8_2sm_g64x4x32.a001/full/nvdisasm.json",
      "storage": "ignored_archive",
      "media_type": "application/json",
      "sha256": "3407a802f3fdd60ff7a6bc726eacd50f81bf59062f42e997b75d95ea31a0bdd0",
      "size_bytes": 273080,
      "producer_step_id": "nvdisasm_json",
      "parent_artifact_ids": [
        "cubin"
      ],
      "sealed": true
    },
    {
      "artifact_id": "nvdisasm_text",
      "role": "NVDISASM_TEXT_FULL",
      "path": "artifacts/codegen-sm110a-v2/phase2-official-20260830/attempts/phase2-official-20260830.blockwise_fp8_2sm_g64x4x32.a001/full/nvdisasm.txt",
      "storage": "ignored_archive",
      "media_type": "text/plain",
      "sha256": "617bf87600204d862b382ac36e4f9bbbb63d7d7c2c11da55a37f2151f111f545",
      "size_bytes": 329375,
      "producer_step_id": "nvdisasm_text",
      "parent_artifact_ids": [
        "cubin"
      ],
      "sealed": true
    },
    {
      "artifact_id": "compile_type_witness_stdout",
      "role": "COMPILE_STDOUT",
      "path": "artifacts/codegen-sm110a-v2/phase2-official-20260830/attempts/phase2-official-20260830.blockwise_fp8_2sm_g64x4x32.a001/full/logs/compile_type_witness.stdout",
      "storage": "ignored_archive",
      "media_type": "text/plain",
      "sha256": "e3b0c44298fc1c149afbf4c8996fb92427ae41e4649b934ca495991b7852b855",
      "size_bytes": 0,
      "producer_step_id": "compile_type_witness",
      "parent_artifact_ids": [],
      "sealed": true
    },
    {
      "artifact_id": "compile_type_witness_stderr",
      "role": "COMPILE_STDERR",
      "path": "artifacts/codegen-sm110a-v2/phase2-official-20260830/attempts/phase2-official-20260830.blockwise_fp8_2sm_g64x4x32.a001/full/logs/compile_type_witness.stderr",
      "storage": "ignored_archive",
      "media_type": "text/plain",
      "sha256": "ca03091b2da3428cf5777c94bfa52fc56b5a64f68b6df5f966a6a00d736f6989",
      "size_bytes": 1834,
      "producer_step_id": "compile_type_witness",
      "parent_artifact_ids": [],
      "sealed": true
    },
    {
      "artifact_id": "run_type_witness_stdout",
      "role": "COMPILE_STDOUT",
      "path": "artifacts/codegen-sm110a-v2/phase2-official-20260830/attempts/phase2-official-20260830.blockwise_fp8_2sm_g64x4x32.a001/full/logs/run_type_witness.stdout",
      "storage": "ignored_archive",
      "media_type": "text/plain",
      "sha256": "bcc0adfc979962cdbc788500c0799bd007b45ab2b99584b18d4be6f8cb954231",
      "size_bytes": 17405,
      "producer_step_id": "run_type_witness",
      "parent_artifact_ids": [],
      "sealed": true
    },
    {
      "artifact_id": "run_type_witness_stderr",
      "role": "COMPILE_STDERR",
      "path": "artifacts/codegen-sm110a-v2/phase2-official-20260830/attempts/phase2-official-20260830.blockwise_fp8_2sm_g64x4x32.a001/full/logs/run_type_witness.stderr",
      "storage": "ignored_archive",
      "media_type": "text/plain",
      "sha256": "e3b0c44298fc1c149afbf4c8996fb92427ae41e4649b934ca495991b7852b855",
      "size_bytes": 0,
      "producer_step_id": "run_type_witness",
      "parent_artifact_ids": [],
      "sealed": true
    },
    {
      "artifact_id": "compile_fatbin_stdout",
      "role": "COMPILE_STDOUT",
      "path": "artifacts/codegen-sm110a-v2/phase2-official-20260830/attempts/phase2-official-20260830.blockwise_fp8_2sm_g64x4x32.a001/full/logs/compile_fatbin.stdout",
      "storage": "ignored_archive",
      "media_type": "text/plain",